{"analysis_scope_digest":"7b47e00a7c7544149d5957ff918c13b3efb115665cac71774408157ecd00d8d1","artifact_kind":"COVERAGE_LEDGER","canonicalization_profile":"veritrail-json-c14n/1","coverage_ledger_digest":"eb02fbbb99c1f4a79aa17ec32887a6bccf6984aa460f0414202dfa53f1f6288d","derivation_profile_digest":"e8bbe54140ff2a082b69d6b6967d8630a423abd135ac6e7be0badc1fe053125b","fact_set_digest":"a1caf8e57c7362649cdbe4c18a857e470bf930f4c6e07b47c95b0cf4af53e45a","overall_coverage_status":"COMPLETE","policy_digest":"ba5d50b166e56a5d8ee3fd8fd56841e8008dd43196c1547840810eb3e6209c4a","relation_set_digest":"62586ad1209dec7e76dbb3af006a7e4099831cbfd149dc3114bad27d463f7d1a","schema_version":"0.1","slice_policy_digest":"6633300a034ccfa2fe4d60a55215cf3c792479a8cdbf23404e9024b50fb6f4a4","slice_set_digest":"da97e3a1552d727225b4354fd96cd87bd0d313ab54209a1a5feebfa7d425c687","source_snapshot_digest":"3acb02f99805fd684ff68a1e0d2a2e24a22d75232564a1f52646c89e4398f747","stages":[{"completed":[{"item_id":"706b672f6d6f642e7079","item_kind":"INVENTORY_ENTRY"}],"conflicts":[],"coverage_status":"COMPLETE","denominator":{"item_refs":[{"item_id":"706b672f6d6f642e7079","item_kind":"INVENTORY_ENTRY"}],"source_digest":"da9da95ac479cfffb9dbda4ba25bbd290e50c851fbf2bb2fdb35301a6abbaf59","state":"KNOWN"},"eligible":[{"item_id":"706b672f6d6f642e7079","item_kind":"INVENTORY_ENTRY"}],"execution_failed":[],"frontier":[],"out_of_scope":[],"parse_failed":[],"reason_codes":[],"stage":"SNAPSHOT_INVENTORY","truncated":[],"unresolved":[],"unsupported":[],"upstream_stage":null},{"completed":[{"item_id":"706b672f6d6f642e7079","item_kind":"INVENTORY_ENTRY"}],"conflicts":[],"coverage_status":"COMPLETE","denominator":{"item_refs":[{"item_id":"706b672f6d6f642e7079","item_kind":"INVENTORY_ENTRY"}],"source_digest":"1f6ee4037d68be34702f3b553381c4fe75b853636cd31434f723e73c5973333b","state":"KNOWN"},"eligible":[{"item_id":"706b672f6d6f642e7079","item_kind":"INVENTORY_ENTRY"}],"execution_failed":[],"frontier":[],"out_of_scope":[],"parse_failed":[],"reason_codes":[],"stage":"POLICY_SCOPE","truncated":[],"unresolved":[],"unsupported":[],"upstream_stage":"SNAPSHOT_INVENTORY"},{"completed":[{"item_id":"706b672f6d6f642e7079","item_kind":"PARSE_UNIT"}],"conflicts":[],"coverage_status":"COMPLETE","denominator":{"item_refs":[{"item_id":"706b672f6d6f642e7079","item_kind":"PARSE_UNIT"}],"source_digest":"f771dfd7b5509d3df1987c65a2d6477af3ccb918d1b9fba4747abdaec8d33b8b","state":"KNOWN"},"eligible":[{"item_id":"706b672f6d6f642e7079","item_kind":"PARSE_UNIT"}],"execution_failed":[],"frontier":[],"out_of_scope":[],"parse_failed":[],"reason_codes":[],"stage":"LANGUAGE_SUPPORT","truncated":[],"unresolved":[],"unsupported":[],"upstream_stage":"POLICY_SCOPE"},{"completed":[{"item_id":"706b672f6d6f642e7079","item_kind":"PARSE_UNIT"}],"conflicts":[],"coverage_status":"COMPLETE","denominator":{"item_refs":[{"item_id":"706b672f6d6f642e7079","item_kind":"PARSE_UNIT"}],"source_digest":"5c932e26286ec566344721e7de0d7247074e42bd4b787e4f99e58df214e674ff","state":"KNOWN"},"eligible":[{"item_id":"706b672f6d6f642e7079","item_kind":"PARSE_UNIT"}],"execution_failed":[],"frontier":[],"out_of_scope":[],"parse_failed":[],"reason_codes":[],"stage":"PARSE","truncated":[],"unresolved":[],"unsupported":[],"upstream_stage":"LANGUAGE_SUPPORT"},{"completed":[{"item_id":"e33dc0d5de5437168c3dfdd548fdab99e319116701b490afc5a50e1b193e7581","item_kind":"FACT"},{"item_id":"e95ac31856ede36bf0642811cce8fe3ba16fe1f4ca22f96e705090b9bee76ed9","item_kind":"FACT"}],"conflicts":[],"coverage_status":"COMPLETE","denominator":{"item_refs":[{"item_id":"e33dc0d5de5437168c3dfdd548fdab99e319116701b490afc5a50e1b193e7581","item_kind":"FACT"},{"item_id":"e95ac31856ede36bf0642811cce8fe3ba16fe1f4ca22f96e705090b9bee76ed9","item_kind":"FACT"}],"source_digest":"e9d1193e27872bbb948fbe3a77831fa42b7bc09202fdeeb7bf5fd765e1c4d0d5","state":"KNOWN"},"eligible":[{"item_id":"e33dc0d5de5437168c3dfdd548fdab99e319116701b490afc5a50e1b193e7581","item_kind":"FACT"},{"item_id":"e95ac31856ede36bf0642811cce8fe3ba16fe1f4ca22f96e705090b9bee76ed9","item_kind":"FACT"}],"execution_failed":[],"frontier":[],"out_of_scope":[],"parse_failed":[],"reason_codes":[],"stage":"FACT_DERIVATION","truncated":[],"unresolved":[],"unsupported":[],"upstream_stage":"PARSE"},{"completed":[{"item_id":"a77f7092282d016afbc8b2f23f70164262b20301f9da4ebb93a068a1dacd66c2","item_kind":"RELATION"},{"item_id":"b3816e40736e23e0cd755aab1dd97501cfc100b32b32bc90effa2615edb13324","item_kind":"RELATION"}],"conflicts":[],"coverage_status":"COMPLETE","denominator":{"item_refs":[{"item_id":"a77f7092282d016afbc8b2f23f70164262b20301f9da4ebb93a068a1dacd66c2","item_kind":"RELATION"},{"item_id":"b3816e40736e23e0cd755aab1dd97501cfc100b32b32bc90effa2615edb13324","item_kind":"RELATION"}],"source_digest":"358954df8c67fa1d6f5f50d0b1011443f94ad54b5b8308f56ae639b4dfaa1124","state":"KNOWN"},"eligible":[{"item_id":"a77f7092282d016afbc8b2f23f70164262b20301f9da4ebb93a068a1dacd66c2","item_kind":"RELATION"},{"item_id":"b3816e40736e23e0cd755aab1dd97501cfc100b32b32bc90effa2615edb13324","item_kind":"RELATION"}],"execution_failed":[],"frontier":[],"out_of_scope":[],"parse_failed":[],"reason_codes":[],"stage":"RELATION_DERIVATION","truncated":[],"unresolved":[],"unsupported":[],"upstream_stage":"FACT_DERIVATION"},{"completed":[{"item_id":"093a23cdafab78e8c1240c756822a872e8f0010bfe05344ba7123455cfd427f1","item_kind":"REVIEW_SLICE"}],"conflicts":[],"coverage_status":"COMPLETE","denominator":{"item_refs":[{"item_id":"093a23cdafab78e8c1240c756822a872e8f0010bfe05344ba7123455cfd427f1","item_kind":"REVIEW_SLICE"}],"source_digest":"3803b1dc2eae19f068c403eb05f32ddfb281df84d6cd8498b052d70220257d63","state":"KNOWN"},"eligible":[{"item_id":"093a23cdafab78e8c1240c756822a872e8f0010bfe05344ba7123455cfd427f1","item_kind":"REVIEW_SLICE"}],"execution_failed":[],"frontier":[],"out_of_scope":[],"parse_failed":[],"reason_codes":[],"stage":"SLICE_DERIVATION","truncated":[],"unresolved":[],"unsupported":[],"upstream_stage":"RELATION_DERIVATION"}]}
